{
  "slug": "salat",
  "guideLevel": "species",
  "plantName": "Salat",
  "latinName": "Lactuca sativa",
  "primaryCategoryId": "fro",
  "summary": "Hurtig bladgrøntsag, som trives bedst i køligt vejr og med jævn fugt.",
  "difficulty": "easy",
  "tags": [
    "bladgroentsag",
    "hurtig",
    "krukke",
    "saasonafgroede",
    "loebende-saaning"
  ],
  "quickFacts": {
    "preCultivation": true,
    "sowingMonths": [
      2,
      3,
      4,
      5,
      6,
      7,
      8
    ],
    "directSowingMonths": [
      3,
      4,
      5,
      6,
      7,
      8
    ],
    "plantingOutMonths": [
      3,
      4,
      5,
      6,
      7,
      8
    ],
    "harvestMonths": [
      4,
      5,
      6,
      7,
      8,
      9,
      10
    ],
    "light": "partial_shade",
    "water": "regular",
    "soil": "Fugtighedsbevarende, næringsrig og veldrænet jord",
    "germinationTemperature": "10-18 °C",
    "germinationDays": "4-10 dage",
    "plantSpacing": "15-30 cm",
    "rowSpacing": "25-35 cm",
    "sowingDepthMm": 5,
    "frostSensitive": false,
    "growthType": "bladroset",
    "height": "10-30 cm",
    "maturityDays": "ca. 28-100 dage afhængigt af type",
    "primaryUse": "Friske blade og hele hoveder"
  },
  "calendarRules": [],
  "sourceLinks": [
    "https://www.rhs.org.uk/vegetables/lettuce/grow-your-own",
    "https://www.rhs.org.uk/vegetables/salad-leaves/grow-your-own",
    "https://www.rhs.org.uk/vegetables/cut-come-again-salads"
  ],
  "sections": [
    {
      "heading": "Sådan vokser salat",
      "content": "Salat danner en roset af blade og kan dyrkes som løse blade, kompakte hoveder eller høje romaine-typer. Den vokser hurtigt i køligt vejr, men kan gå i stok og blive bitter under varme og tørke.\n\n:::fact{variant=\"comparison\" title=\"Pluksalat eller hovedsalat?\"}\nDu kan vælge efter, hvor hurtigt og hvordan du vil høste.\n\n### Vælg pluksalat hvis\n\n- du vil høste unge blade hurtigt\n- du sår tæt og ofte\n- du vil klippe flere gange\n\n### Vælg hovedsalat hvis\n\n- du vil have et fast, samlet hoved\n- du kan give planterne mere plads\n- du vil vente længere på høsten\n:::"
    },
    {
      "heading": "Så lidt og ofte",
      "content": "Så små hold hver anden eller tredje uge fra tidligt forår til sensommer. Det giver en mere jævn høst og mindsker risikoen for, at alle planter bliver klar samtidig.\n\nDæk frøene kun let. Salat spirer bedst køligt, og meget varm jord kan hæmme spiringen. I varme perioder kan du så i skygge eller indendørs og plante ud senere."
    },
    {
      "heading": "Placering gennem året",
      "content": "Giv salat sol i forår og efterår. Om sommeren hjælper let skygge midt på dagen med at holde planterne kølige og forsinke stokløbning.\n\nSalat trives i bed, højbed, krukke og altankasse, så længe jorden holder jævnt på fugten."
    },
    {
      "heading": "Vand jævnt",
      "content": "Hold jorden fugtig uden at gøre den vandmættet. Tørke giver små, bitre blade og kan udløse stokløbning.\n\nVand ved jorden og helst om morgenen. I krukker kan planterne kræve daglig kontrol i varmt vejr."
    },
    {
      "heading": "Giv planterne plads",
      "content": "Tynd småplanterne, så de ikke står tæt. Afstanden afhænger af typen: pluksalat kan stå tæt, mens hovedsalat kræver mere plads for at danne et fast hoved.\n\nDe planter, du tynder væk, kan spises som små blade."
    },
    {
      "heading": "Høst på flere måder",
      "content": "Pluk yderblade løbende, klip unge blade nogle centimeter over jorden, eller skær hele hovedet af ved basis. Høst gerne om morgenen, når bladene er sprøde.\n\nHovedsalat bruger ofte 10-14 uger, mens løse blade kan høstes langt tidligere."
    },
    {
      "heading": "Når salaten går i stok",
      "content": "Når planten danner en høj blomsterstængel, bliver bladene ofte bitre. Varme, tørke, lange dage og roduro kan udløse stokløbning.\n\nHøst planten, før stænglen bliver høj, og så en ny omgang på et køligere sted."
    },
    {
      "heading": "Typiske problemer",
      "content": "Snegle kan ødelægge unge planter hurtigt. Beskyt nyplantninger og fjern skjulesteder tæt på bedet.\n\nBladlus og meldug kan også forekomme. Giv planterne luft, vand ved jorden og fjern syge blade."
    }
  ]
}
