{
  "slug": "tomat-sungold",
  "guideLevel": "variety",
  "parentSlug": "tomat",
  "plantName": "Tomat",
  "variety": "Sungold",
  "latinName": "Solanum lycopersicum 'Sungold'",
  "primaryCategoryId": "fro",
  "summary": "Tidlig orange cherrytomat med intens sødme, frugtig smag og lange, rige klaser.",
  "difficulty": "easy",
  "tags": [
    "cherrytomat",
    "orange",
    "soed",
    "tidlig",
    "f1-hybrid"
  ],
  "quickFacts": {
    "harvestMonths": [
      7,
      8,
      9,
      10
    ],
    "light": "full_sun",
    "water": "regular",
    "plantSpacing": "45-60 cm",
    "frostSensitive": true,
    "growthType": "ranketomat",
    "height": "150-220 cm",
    "maturityDays": "ca. 57-65 dage",
    "primaryUse": "Frisk spisning og salater"
  },
  "calendarRules": [],
  "sourceLinks": [
    "https://www.rhs.org.uk/plants/293979/solanum-lycopersicum-sungold/details",
    "https://www.johnnyseeds.com/vegetables/tomatoes/cherry-tomatoes/sun-gold-f1-tomato-seed-770.html",
    "https://www.johnnyseeds.com/growers-library/vegetables/tomatoes/library-vegetables-grow-rainbow-cherry-tomatoes.html",
    "https://www.johnnyseeds.com/research-farm/3-new-johnnys-bred-stories-by-rob-johnston.html"
  ],
  "sections": [
    {
      "heading": "Om sorten",
      "content": "Sungold er en orange cherrytomat, som især dyrkes for sin intense sødme og frugtige smag. Den sætter lange klaser med små, runde frugter og begynder ofte at modne tidligere end større tomatsorter.\n\nPlanten vokser kraftigt som ranketomat. Den fortsætter med at sætte nye klaser gennem sommeren og kan høstes langt ind i efteråret under glas."
    },
    {
      "heading": "Vælg Sungold hvis",
      "content": "Vælg Sungold, hvis du vil have en tomat til at spise direkte fra planten. Den passer godt til familier, små haver og dyrkere, der prioriterer tidlig og løbende høst frem for store frugter til sauce.\n\n:::fact{variant=\"comparison\" title=\"Sungold eller rød cherrytomat?\"}\nForskellen handler mest om smag, farve og frugtens holdbarhed.\n\n### Vælg Sungold hvis\n\n- du vil have meget søde, orange frugter\n- du prioriterer tidlig høst\n- du høster ofte og spiser tomaterne hurtigt\n\n### Vælg en fast rød cherrytomat hvis\n\n- du vil gemme frugterne lidt længere\n- du foretrækker mere klassisk tomatsmag\n- du vil mindske risikoen for revner\n:::"
    },
    {
      "heading": "Sådan adskiller den sig",
      "content": "Sungold regnes som tidlig og kan under gode forhold give de første modne frugter omkring 58-65 dage efter udplantning. Den producerer mange små frugter frem for færre store.\n\nFrugterne er modne, når de skifter fra gul til varm, dyb orange. Smagen bliver sødere, jo længere de hænger, men meget modne frugter revner lettere."
    },
    {
      "heading": "Det skal du være opmærksom på",
      "content": "Sungolds største svaghed er frugternes tendens til at revne. Hold vandingen stabil, og høst modne frugter før kraftig regn eller efter en periode med tørke. Pluk ofte, især i varmt vejr.\n\nPlanten er livskraftig og skal bindes op løbende. Knib sideskud som på andre ranketomater, og sørg for luft mellem bladene. Lange klaser kan blive tunge, men bør normalt ikke beskæres, medmindre planten tydeligt er overbelastet."
    },
    {
      "heading": "Høst og brug",
      "content": "Pluk Sungold, når frugten er helt orange og slipper let. Spis den frisk, brug den i salater eller bag hele tomater kort i ovnen. Den høje sødme passer også godt sammen med syrlige ingredienser.\n\nFrugterne holder ikke lige så længe som fastere sorter. Læg dem i ét lag ved stuetemperatur og brug dem hurtigt. Køleskab dæmper smagen."
    },
    {
      "heading": "Frø og næste sæson",
      "content": "Sungold er en F1-hybrid. Frø fra dine egne frugter vil derfor ikke nødvendigvis give planter med samme smag, farve eller vækst næste år. Køb nye frø, hvis du vil dyrke den samme sort igen.\n\n:::next-guide\ntitle: Lær tomaten at kende\ndescription: Få hele dyrkningsfundamentet for ranketomater.\nslug: tomat\nlabel: Læs artsguiden\n:::"
    }
  ]
}
